{
  "schema_version": "1.0",
  "protocol_id": "cloud-security-independent-evaluation",
  "protocol_version": "1.0.0",
  "status": "frozen",
  "frozen_on": "2026-08-12",
  "release_target": "v2.2.0",
  "candidate": {
    "repository": "https://github.com/LLOYD-11/cloud_security_misconfiguration_lab",
    "analyzer_revision": "6d71c99914a38b6e161bc9cf56407eb1757b8c9a",
    "package_version": "2.1.1",
    "rule_catalog": {
      "path": "cloud_rules/rules-v1.0.json",
      "schema_version": "1.0",
      "sha256": "5842caa836d7b8970ae9aef1261652cdd8f98a1c49598962de32be58c9e998a0",
      "rule_count": 35
    },
    "modules": [
      {
        "id": "iam",
        "rule_prefix": "IAM",
        "rule_count": 15,
        "rule_ids": [
          "IAM-001",
          "IAM-002",
          "IAM-003",
          "IAM-004",
          "IAM-005",
          "IAM-006",
          "IAM-007",
          "IAM-008",
          "IAM-009",
          "IAM-010",
          "IAM-011",
          "IAM-012",
          "IAM-013",
          "IAM-014",
          "IAM-015"
        ],
        "input_forms": [
          "native",
          "simplified"
        ]
      },
      {
        "id": "storage",
        "rule_prefix": "STO",
        "rule_count": 6,
        "rule_ids": [
          "STO-001",
          "STO-002",
          "STO-003",
          "STO-004",
          "STO-005",
          "STO-006"
        ],
        "input_forms": [
          "native",
          "simplified"
        ]
      },
      {
        "id": "network",
        "rule_prefix": "NET",
        "rule_count": 3,
        "rule_ids": [
          "NET-001",
          "NET-002",
          "NET-003"
        ],
        "input_forms": [
          "native",
          "simplified"
        ]
      },
      {
        "id": "cloudtrail",
        "rule_prefix": "CLD",
        "rule_count": 11,
        "rule_ids": [
          "CLD-001",
          "CLD-002",
          "CLD-003",
          "CLD-004",
          "CLD-005",
          "CLD-006",
          "CLD-007",
          "CLD-008",
          "CLD-009",
          "CLD-010",
          "CLD-011"
        ],
        "input_forms": [
          "native",
          "simplified"
        ]
      }
    ]
  },
  "research_questions": [
    {
      "id": "RQ1",
      "primary": true,
      "question": "How accurately does the frozen analyzer classify independently authored IAM, S3, EC2 security-group, and CloudTrail evidence within its documented offline scope?"
    },
    {
      "id": "RQ2",
      "primary": false,
      "question": "Do equivalent native AWS-shaped and simplified inputs produce the same rule and resource decisions?"
    },
    {
      "id": "RQ3",
      "primary": false,
      "question": "How often does the analyzer agree with pinned established baselines on predicates whose evidence and semantics directly overlap?"
    },
    {
      "id": "RQ4",
      "primary": false,
      "question": "What measured effect do optional reachability context and incident correlation have without changing the underlying configuration or event evidence?"
    }
  ],
  "independence_controls": {
    "model": "procedural-not-institutional",
    "candidate_output_access_before_label_freeze": false,
    "candidate_source_may_be_known": true,
    "third_party_review_claimed": false,
    "holdout_separation": "Evaluation evidence, labels, and case generators must not be copied from or generated by the repository benchmark, sample data, analyzer tests, or candidate findings.",
    "label_freeze_condition": "All evidence files, assertions, citations, transformations, and SHA-256 digests must be committed before the candidate is run on any evaluation case.",
    "disclosure": "The project author may perform both review passes with an explicit context separation. This is procedural holdout evaluation, not an independent laboratory replication or third-party certification."
  },
  "corpus_design": {
    "case_classes": [
      "positive",
      "hardened-negative",
      "boundary",
      "ambiguous"
    ],
    "allowed_origins": [
      "independently-authored-synthetic",
      "official-documentation-derived",
      "public-open-source-derived"
    ],
    "excluded_project_sources": [
      "cloud_benchmarks/",
      "sample_data/",
      "iam_analyzer/test_analyzer.py",
      "storage_analyzer/test_analyzer.py",
      "network_analyzer/test_analyzer.py",
      "cloudtrail_detector/test_detector.py",
      "reports/cloud_security_report_sample.md",
      "reports/generated/"
    ],
    "minimum_case_counts_per_module": {
      "positive": 2,
      "hardened-negative": 2,
      "boundary": 2,
      "ambiguous": 2
    },
    "minimum_scored_assertions_per_rule": {
      "positive": 2,
      "negative": 2
    },
    "minimum_native_simplified_pairs_per_module": 2,
    "single_occurrence_per_decision_key": true,
    "decision_key_fields": [
      "case_id",
      "rule_id",
      "resource_type",
      "resource_id"
    ],
    "sanitization_requirements": [
      "Use fictional principals, resources, event IDs, and AWS account IDs.",
      "Use RFC 5737 addresses or private CIDRs instead of observed public addresses.",
      "Remove secrets, tokens, personal data, customer data, and organization identifiers.",
      "Record every semantic transformation and verify that sanitization does not change the labelled predicate."
    ]
  },
  "ground_truth": {
    "labels": [
      "positive",
      "negative",
      "ambiguous",
      "unsupported"
    ],
    "positive_definition": "The retained evidence directly satisfies the frozen lab rule predicate for the declared resource.",
    "negative_definition": "The retained evidence contains the fields needed to evaluate the frozen rule and does not satisfy its predicate.",
    "ambiguous_definition": "Authoritative sources or retained evidence permit more than one reasonable in-scope interpretation.",
    "unsupported_definition": "The retained evidence is insufficient for the rule or the claim falls outside the documented analyzer scope.",
    "authoritative_source_requirement": "Every assertion must cite at least one official AWS specification, API reference, user guide, or security-control definition that supports the label.",
    "baseline_role": "External tool output may corroborate or challenge an annotation but must never be its sole ground-truth source.",
    "review_stages": [
      "Primary annotation from retained evidence and cited authoritative semantics without candidate output.",
      "A separate verification pass checks the decision key, label, severity, rationale, citations, and evidence completeness without candidate output.",
      "Disagreement is resolved from retained evidence and cited semantics; unresolved cases are labelled ambiguous rather than forced into a scored class."
    ],
    "universe_rule": "Every applicable rule and resource decision in each case must have an assertion. An undeclared candidate prediction is reported as a false positive and a corpus-completeness defect; it is never silently discarded.",
    "post_run_change_rule": "Labels and evidence are immutable after candidate execution. Corrections require a versioned erratum that preserves the original result and explains the impact."
  },
  "external_baselines": [
    {
      "id": "prowler-aws",
      "name": "Prowler AWS provider",
      "version": "5.38.0",
      "commit_sha": "b21ddad32c6d9a98eb819f0ccadac8a6792c2837",
      "release_url": "https://github.com/prowler-cloud/prowler/releases/tag/5.38.0",
      "source_url": "https://github.com/prowler-cloud/prowler/tree/b21ddad32c6d9a98eb819f0ccadac8a6792c2837",
      "modules": [
        "iam",
        "storage",
        "network"
      ],
      "comparison_scope": "Configuration and credential-posture checks with directly overlapping retained evidence and predicates.",
      "ground_truth_role": "corroborating-only"
    },
    {
      "id": "sigma-core",
      "name": "Sigma Core rules",
      "version": "r2026-07-01",
      "commit_sha": "552f3fee420ef232a8e5790c4fae591847e32347",
      "release_url": "https://github.com/SigmaHQ/sigma/releases/tag/r2026-07-01",
      "source_url": "https://github.com/SigmaHQ/sigma/tree/552f3fee420ef232a8e5790c4fae591847e32347",
      "release_asset": {
        "name": "sigma_core.zip",
        "sha256": "45ccbd62cbf0d7ccca6f44eaa010f86bb24f082b5411c5e22c71907e7770ee46"
      },
      "modules": [
        "cloudtrail"
      ],
      "comparison_scope": "Released AWS CloudTrail detections whose selections can be evaluated from fields retained by the corpus.",
      "ground_truth_role": "corroborating-only"
    }
  ],
  "scoring": {
    "primary_unit": "One pre-labelled case, rule, resource type, and resource ID decision key.",
    "included_labels": [
      "positive",
      "negative"
    ],
    "excluded_labels": [
      "ambiguous",
      "unsupported"
    ],
    "true_positive": "A positive assertion with exactly one matching candidate finding.",
    "false_negative": "A positive assertion without a matching candidate finding.",
    "true_negative": "A negative assertion without a matching candidate finding.",
    "false_positive": "A negative assertion with a matching finding, an extra finding for an already matched decision key, or an undeclared candidate prediction.",
    "duplicate_rule": "The corpus permits at most one expected finding per decision key. Extra candidate findings are false positives and are reported separately as duplicate predictions.",
    "metrics": [
      "precision",
      "recall",
      "f1",
      "specificity"
    ],
    "aggregations": [
      "overall-micro",
      "per-module",
      "per-rule"
    ],
    "confidence_intervals": {
      "method": "wilson-score",
      "confidence_level": 0.95,
      "applies_to": [
        "precision",
        "recall",
        "specificity"
      ]
    },
    "zero_denominator_policy": "Report null and the underlying counts; never substitute zero or one.",